{
  "id": "ROE-2026-COMP-001",
  "version": "1.0",
  "organization": "Enterprise Security Partners, LLC",
  "title": "Comprehensive Security Assessment - Financial Services Division",
  "description": "Full-scope penetration testing engagement covering network infrastructure, web applications, wireless networks, and physical security assessments. This engagement is authorized under Master Services Agreement MSA-2025-1234 and Statement of Work SOW-2026-0001. All testing activities must comply with PCI-DSS, SOX, and GLBA regulations. Testing includes but is not limited to: external and internal network penetration testing, web application security assessment, wireless security evaluation, social engineering assessment (email phishing only), and password policy validation.",
  "authorized_operators": [
    "op-senior-001",
    "op-senior-002",
    "op-lead-001",
    "op-analyst-001",
    "op-analyst-002",
    "op-analyst-003"
  ],
  "client_name": "Global Financial Services Corp",
  "start_time": "2026-01-24T00:00:00Z",
  "end_time": "2026-03-31T23:59:59Z",
  "authorized_cidrs": [
    "10.0.0.0/8",
    "172.16.0.0/12",
    "192.168.0.0/16",
    "203.0.113.0/24",
    "198.51.100.0/24"
  ],
  "authorized_domains": [
    "*.globalfinancial.test",
    "*.gfs-internal.test",
    "api.globalfinancial.test",
    "portal.globalfinancial.test",
    "mobile-api.globalfinancial.test",
    "dev.*.globalfinancial.test",
    "staging.*.globalfinancial.test",
    "qa.*.globalfinancial.test"
  ],
  "excluded_targets": [
    "10.0.0.1/32",
    "10.0.0.2/32",
    "10.1.0.0/16",
    "172.16.0.1/32",
    "192.168.0.1/32",
    "prod.globalfinancial.test",
    "live.globalfinancial.test",
    "core-banking.gfs-internal.test",
    "swift.gfs-internal.test",
    "pci-zone.gfs-internal.test",
    "203.0.113.1/32",
    "198.51.100.1/32"
  ],
  "authorized_techniques": [
    "T1595",
    "T1592",
    "T1589",
    "T1590",
    "T1591",
    "T1598",
    "T1597",
    "T1596",
    "T1593",
    "T1594",
    "T1046",
    "T1040",
    "T1018",
    "T1016",
    "T1049",
    "T1082",
    "T1083",
    "T1057",
    "T1518",
    "T1012",
    "T1087",
    "T1069",
    "T1201",
    "T1120",
    "T1135",
    "T1007",
    "T1124",
    "T1497",
    "T1614",
    "T1110",
    "T1187",
    "T1557",
    "T1558",
    "T1552",
    "T1555",
    "T1550",
    "T1078",
    "T1190",
    "T1133",
    "T1566",
    "T1189",
    "T1203",
    "T1059",
    "T1053",
    "T1055"
  ],
  "prohibited_techniques": [
    "T1486",
    "T1485",
    "T1561",
    "T1490",
    "T1529",
    "T1495",
    "T1531",
    "T1565",
    "T1499",
    "T1498",
    "T1496",
    "T1491",
    "T1489"
  ],
  "max_exfil_rate": 52428800,
  "max_exfil_total": 10737418240,
  "emergency_contacts": [
    {
      "name": "Robert Chen",
      "role": "Chief Information Security Officer",
      "phone": "+1-555-0200",
      "email": "rchen@globalfinancial.test"
    },
    {
      "name": "Sarah Williams",
      "role": "VP of Information Security",
      "phone": "+1-555-0201",
      "email": "swilliams@globalfinancial.test"
    },
    {
      "name": "Michael Johnson",
      "role": "Security Operations Manager",
      "phone": "+1-555-0202",
      "email": "mjohnson@globalfinancial.test"
    },
    {
      "name": "Emily Davis",
      "role": "Incident Response Team Lead",
      "phone": "+1-555-0203",
      "email": "edavis@globalfinancial.test"
    },
    {
      "name": "David Martinez",
      "role": "Lead Penetration Tester",
      "phone": "+1-555-0204",
      "email": "dmartinez@enterprisesecurity.test"
    },
    {
      "name": "24/7 SOC Hotline",
      "role": "Security Operations Center",
      "phone": "+1-555-0299",
      "email": "soc-alert@globalfinancial.test"
    }
  ],
  "constraints": [
    "All testing must comply with PCI-DSS requirements",
    "SOX-regulated systems require 24-hour advance notification",
    "No testing during quarterly financial closing periods (last 3 business days of each quarter)",
    "Core banking systems are strictly off-limits",
    "SWIFT network components are excluded from scope",
    "No denial of service or resource exhaustion attacks",
    "Social engineering limited to email phishing with pre-approved templates",
    "No physical penetration testing without separate written authorization",
    "All exploitation attempts require prior notification to SOC",
    "Immediate halt if any production transaction processing is affected",
    "Weekly status reports required to CISO",
    "All findings rated Critical or High must be reported within 24 hours",
    "Data exfiltration testing limited to synthetic/test data only",
    "No customer PII or financial data may be accessed or exfiltrated",
    "Credential harvesting limited to test accounts only"
  ],
  "created_at": "2026-01-15T10:00:00Z",
  "signer_public_key": "",
  "signature": ""
}
