{
  "id": "ROE-2026-MINIMAL-001",
  "version": "1.0",
  "organization": "Your Security Company",
  "title": "Internal Security Assessment",
  "description": "Minimal ROE for quick internal assessments",
  "authorized_operators": [
    "operator-001"
  ],
  "client_name": "Internal",
  "start_time": "2026-01-24T09:00:00Z",
  "end_time": "2026-01-24T17:00:00Z",
  "authorized_cidrs": [
    "192.168.0.0/16"
  ],
  "authorized_domains": [],
  "excluded_targets": [
    "192.168.1.1/32"
  ],
  "authorized_techniques": [],
  "prohibited_techniques": [
    "T1486",
    "T1485",
    "T1561"
  ],
  "max_exfil_rate": null,
  "max_exfil_total": null,
  "emergency_contacts": [
    {
      "name": "Security Lead",
      "role": "Primary Contact",
      "phone": "+1-555-0100",
      "email": "security@example.internal"
    }
  ],
  "constraints": [],
  "created_at": "2026-01-24T08:00:00Z",
  "signer_public_key": "",
  "signature": ""
}
