{
  "id": "ROE-2026-RT-001",
  "version": "1.0",
  "organization": "Advanced Threat Simulation Group",
  "title": "Red Team Exercise - Operation Crimson Dawn",
  "description": "Full-scope adversary simulation exercise designed to test organizational detection and response capabilities. This engagement simulates advanced persistent threat (APT) tactics, techniques, and procedures. The exercise includes social engineering, physical security testing (pre-approved locations only), and assumes breach scenarios. All activities are coordinated with the White Team for safety and oversight.",
  "authorized_operators": [
    "rt-lead-001",
    "rt-operator-001",
    "rt-operator-002",
    "rt-operator-003",
    "rt-specialist-social",
    "rt-specialist-physical"
  ],
  "client_name": "Megacorp Industries",
  "start_time": "2026-02-01T00:00:00Z",
  "end_time": "2026-02-28T23:59:59Z",
  "authorized_cidrs": [
    "10.0.0.0/8",
    "172.16.0.0/12",
    "192.168.0.0/16",
    "203.0.113.0/24",
    "198.51.100.0/24",
    "100.64.0.0/10"
  ],
  "authorized_domains": [
    "*.megacorp.test",
    "*.megacorp-internal.test",
    "*.corp.megacorp.test",
    "vpn.megacorp.test",
    "mail.megacorp.test",
    "owa.megacorp.test",
    "sharepoint.megacorp.test",
    "teams.megacorp.test",
    "azure.megacorp.test",
    "aws.megacorp.test"
  ],
  "excluded_targets": [
    "10.0.0.1/32",
    "172.16.0.1/32",
    "192.168.0.1/32",
    "scada.megacorp-internal.test",
    "ics.megacorp-internal.test",
    "safety.megacorp-internal.test",
    "hospital.megacorp.test",
    "emergency.megacorp.test",
    "backup-dc.megacorp-internal.test"
  ],
  "authorized_techniques": [
    "T1595",
    "T1592",
    "T1589",
    "T1590",
    "T1591",
    "T1598",
    "T1597",
    "T1596",
    "T1593",
    "T1594",
    "T1583",
    "T1584",
    "T1585",
    "T1586",
    "T1587",
    "T1588",
    "T1608",
    "T1046",
    "T1040",
    "T1018",
    "T1016",
    "T1049",
    "T1082",
    "T1083",
    "T1057",
    "T1518",
    "T1012",
    "T1087",
    "T1069",
    "T1201",
    "T1120",
    "T1135",
    "T1007",
    "T1124",
    "T1497",
    "T1614",
    "T1110",
    "T1187",
    "T1557",
    "T1558",
    "T1552",
    "T1555",
    "T1550",
    "T1078",
    "T1190",
    "T1133",
    "T1566",
    "T1189",
    "T1195",
    "T1199",
    "T1200",
    "T1203",
    "T1059",
    "T1053",
    "T1055",
    "T1106",
    "T1129",
    "T1047",
    "T1543",
    "T1547",
    "T1546",
    "T1098",
    "T1134",
    "T1548",
    "T1068",
    "T1484",
    "T1574",
    "T1140",
    "T1027",
    "T1564",
    "T1562",
    "T1070",
    "T1036",
    "T1112",
    "T1601",
    "T1207",
    "T1556",
    "T1218",
    "T1216",
    "T1221",
    "T1205",
    "T1127",
    "T1535",
    "T1071",
    "T1132",
    "T1001",
    "T1568",
    "T1573",
    "T1008",
    "T1105",
    "T1104",
    "T1095",
    "T1571",
    "T1572",
    "T1090",
    "T1219",
    "T1102",
    "T1020",
    "T1030",
    "T1041",
    "T1011",
    "T1052",
    "T1567",
    "T1537",
    "T1531"
  ],
  "prohibited_techniques": [
    "T1486",
    "T1485",
    "T1561",
    "T1490",
    "T1529",
    "T1495",
    "T1565",
    "T1499",
    "T1498"
  ],
  "max_exfil_rate": 104857600,
  "max_exfil_total": 53687091200,
  "emergency_contacts": [
    {
      "name": "White Team Lead",
      "role": "Exercise Oversight",
      "phone": "+1-555-0400",
      "email": "whiteteam@megacorp.test"
    },
    {
      "name": "CISO Office",
      "role": "Executive Sponsor",
      "phone": "+1-555-0401",
      "email": "ciso@megacorp.test"
    },
    {
      "name": "Blue Team Lead",
      "role": "Defender Coordination",
      "phone": "+1-555-0402",
      "email": "blueteam@megacorp.test"
    },
    {
      "name": "Legal Counsel",
      "role": "Legal Oversight",
      "phone": "+1-555-0403",
      "email": "legal@megacorp.test"
    },
    {
      "name": "Red Team Lead",
      "role": "Attack Team Lead",
      "phone": "+1-555-0410",
      "email": "rtlead@advancedthreat.test"
    },
    {
      "name": "24/7 Deconfliction Hotline",
      "role": "Emergency Contact",
      "phone": "+1-555-0499",
      "email": "deconflict@megacorp.test"
    }
  ],
  "constraints": [
    "White Team must be notified before any high-impact actions",
    "SCADA/ICS systems are completely off-limits",
    "Hospital and emergency services systems are excluded",
    "Physical testing only at pre-approved locations with escort",
    "Social engineering requires pre-approved pretexts only",
    "No actual malware deployment - simulation tools only",
    "Data destruction techniques are simulated only",
    "Credential harvesting limited to test/simulation accounts",
    "Daily check-in with White Team required",
    "Immediate halt for any safety concerns",
    "All C2 infrastructure must be documented and disclosed to White Team",
    "Purple Team sessions scheduled for technique validation",
    "Weekly adversary simulation reports required",
    "Persistence mechanisms must be documented for removal",
    "No testing during declared blackout periods",
    "Backup domain controller is excluded to ensure recovery capability"
  ],
  "created_at": "2026-01-15T09:00:00Z",
  "signer_public_key": "",
  "signature": ""
}
